Budget_Rs,Dish,Affordable_Ingredients,Calories,Recipe
350,Chicken Curry Small,"Chicken 500g, Onion, Spices",420,Cook chicken with onion and spices.
400,Veg Fried Rice,"Rice 300g, Mixed veg, Soy sauce",380,"Stir fry veggies, add rice and sauce."
500,Chicken Biryani,"Rice 500g, Chicken 700g, Spices",650,"Layer cooked rice and chicken, steam."
700,Anda Chana Curry,"Eggs, Boiled chickpeas, Onion",550,"Cook curry base, add eggs & chana."
900,Beef Keema,"Beef 700g, Onion, Spices",700,Cook minced beef with spices.
